[
  {
    "provider": "groq",
    "model_id": "openai/gpt-oss-120b",
    "status": "admitted",
    "data_policy_class": "no-training",
    "card_required": "no",
    "price_usd_per_mtok_in": 0,
    "price_usd_per_mtok_out": 0,
    "rpm": 30,
    "rpd": 1000,
    "tpm": 8000,
    "tpd": 200000,
    "reset_boundary": null,
    "allowed_roles": [
      "diagnosis",
      "test-idea",
      "small-diff-review"
    ],
    "max_attempts": 3,
    "timeout_s": 60,
    "last_smoke": "2026-08-31T13:32:00Z",
    "source_url": "https://console.groq.com/docs/rate-limits",
    "terms_hash": "sha256:0d9c0768b1be26f693227bddca07a1baf9d3c9e73dbf8abd1223a21e702c9176",
    "output_is_data": true
  },
  {
    "provider": "groq",
    "model_id": "openai/gpt-oss-20b",
    "status": "admitted",
    "data_policy_class": "no-training",
    "card_required": "no",
    "price_usd_per_mtok_in": 0,
    "price_usd_per_mtok_out": 0,
    "rpm": 30,
    "rpd": 1000,
    "tpm": 8000,
    "tpd": 200000,
    "reset_boundary": null,
    "allowed_roles": [
      "diagnosis",
      "test-idea",
      "small-diff-review"
    ],
    "max_attempts": 3,
    "timeout_s": 60,
    "last_smoke": "2026-08-31T13:32:00Z",
    "source_url": "https://console.groq.com/docs/rate-limits",
    "terms_hash": "sha256:0d9c0768b1be26f693227bddca07a1baf9d3c9e73dbf8abd1223a21e702c9176",
    "output_is_data": true
  },
  {
    "provider": "nvidia",
    "model_id": "hosted-nim-trial",
    "status": "not-admitted",
    "data_policy_class": "unknown",
    "card_required": "unverified",
    "price_usd_per_mtok_in": null,
    "price_usd_per_mtok_out": null,
    "rpm": null,
    "rpd": null,
    "tpm": null,
    "tpd": null,
    "reset_boundary": null,
    "allowed_roles": [],
    "max_attempts": 3,
    "timeout_s": 60,
    "last_smoke": null,
    "source_url": "https://docs.nvidia.com/nim/large-language-models/latest/",
    "terms_hash": "sha256:4bdb5c01ca9be15a3331e848cc5c9454a19523695902c2724964ec93040bcf83"
  },
  {
    "provider": "openrouter",
    "model_id": "inclusionai/ling-3.0-flash-fin:free",
    "status": "admitted",
    "data_policy_class": "training",
    "card_required": "no",
    "price_usd_per_mtok_in": 0,
    "price_usd_per_mtok_out": 0,
    "rpm": 16,
    "rpd": 50,
    "tpm": null,
    "tpd": null,
    "reset_boundary": null,
    "allowed_roles": [
      "synthetic-benchmark"
    ],
    "max_attempts": 3,
    "timeout_s": 60,
    "last_smoke": "2026-08-31T14:05:00Z",
    "source_url": "https://openrouter.ai/models",
    "terms_hash": "sha256:0407392c122f59808683cc5fb5a80f27eace605870a1cbee862baacdb8bcd8a1"
  },
  {
    "provider": "openrouter",
    "model_id": "poolside/laguna-s-2.1:free",
    "status": "quarantined",
    "data_policy_class": "training",
    "card_required": "no",
    "price_usd_per_mtok_in": 0,
    "price_usd_per_mtok_out": 0,
    "rpm": 16,
    "rpd": 50,
    "tpm": null,
    "tpd": null,
    "reset_boundary": null,
    "allowed_roles": [],
    "max_attempts": 3,
    "timeout_s": 60,
    "last_smoke": "2026-08-31T14:05:00Z",
    "source_url": "https://openrouter.ai/models",
    "terms_hash": "sha256:0407392c122f59808683cc5fb5a80f27eace605870a1cbee862baacdb8bcd8a1"
  },
  {
    "provider": "google",
    "model_id": "gemini-3.5-flash",
    "status": "admitted",
    "data_policy_class": "training",
    "card_required": "no",
    "price_usd_per_mtok_in": 0,
    "price_usd_per_mtok_out": 0,
    "rpm": 5,
    "rpd": 20,
    "tpm": 250000,
    "tpd": null,
    "reset_boundary": "daily 00:00 America/Los_Angeles",
    "allowed_roles": [
      "synthetic-benchmark"
    ],
    "max_attempts": 3,
    "timeout_s": 60,
    "last_smoke": "2026-08-31T14:20:00Z",
    "source_url": "https://ai.google.dev/gemini-api/docs/pricing",
    "terms_hash": "sha256:f1ce14a476361515157fd04a84994c4de6140cb8e193d6f45f735c444a2719df",
    "billing_disabled_attested": "2026-09-02 JP: gen-lang-client-0953111595"
  },
  {
    "provider": "google",
    "model_id": "gemini-3.5-flash-lite",
    "status": "admitted",
    "data_policy_class": "training",
    "card_required": "no",
    "price_usd_per_mtok_in": 0,
    "price_usd_per_mtok_out": 0,
    "rpm": 15,
    "rpd": 500,
    "tpm": 250000,
    "tpd": null,
    "reset_boundary": "daily 00:00 America/Los_Angeles",
    "allowed_roles": [
      "synthetic-benchmark",
      "public-repo-read"
    ],
    "max_attempts": 3,
    "timeout_s": 60,
    "last_smoke": "2026-08-31T14:20:00Z",
    "source_url": "https://ai.google.dev/gemini-api/docs/pricing",
    "terms_hash": "sha256:f1ce14a476361515157fd04a84994c4de6140cb8e193d6f45f735c444a2719df",
    "billing_disabled_attested": "2026-09-02 JP: gen-lang-client-0953111595"
  },
  {
    "provider": "local",
    "model_id": "qwen3.5:4b",
    "status": "admitted",
    "data_policy_class": "no-training",
    "card_required": "no",
    "price_usd_per_mtok_in": 0,
    "price_usd_per_mtok_out": 0,
    "rpm": null,
    "rpd": null,
    "tpm": null,
    "tpd": null,
    "reset_boundary": null,
    "allowed_roles": [
      "synthetic-benchmark",
      "public-repo-read"
    ],
    "max_attempts": 3,
    "timeout_s": 60,
    "last_smoke": "2026-09-01T19:03:00Z",
    "source_url": "https://ollama.com/library/qwen3.5",
    "terms_hash": null,
    "output_is_data": true
  }
]
